{
  "schemaVersion": 1,
  "id": "uuid-validator",
  "version": "1.0.0",
  "type": "reference",
  "family": "developer-tools",
  "variant": "reference",
  "slug": "uuid-validator",
  "icon": "developer",
  "publishedAt": "2026-08-03",
  "updatedAt": "2026-08-03",
  "featured": false,
  "popularity": 67,
  "estimatedTime": "instant",
  "status": "published",
  "entry": "./index.js",
  "category": "developer",
  "tags": [
    "uuid",
    "guid",
    "validate"
  ],
  "aliases": [
    "uuid checker",
    "guid validator"
  ],
  "components": [
    "tool.shell",
    "field.textarea",
    "action.button"
  ],
  "capabilities": {
    "offline": true,
    "fileAccess": false,
    "networkAccess": false,
    "webWorker": false
  },
  "discovery": {
    "priority": 236
  }
}
