{
  "schemaVersion": 1,
  "id": "url-decoder",
  "version": "1.0.0",
  "type": "converter",
  "family": "text-tools",
  "variant": "converter",
  "slug": "url-decoder",
  "icon": "text",
  "publishedAt": "2026-08-03",
  "updatedAt": "2026-08-03",
  "featured": false,
  "popularity": 65,
  "estimatedTime": "instant",
  "status": "published",
  "entry": "./index.js",
  "category": "text",
  "tags": [
    "text",
    "url",
    "decoder"
  ],
  "aliases": [
    "url decoder",
    "url decoder online"
  ],
  "components": [
    "tool.shell",
    "field.textarea",
    "action.button"
  ],
  "capabilities": {
    "offline": true,
    "fileAccess": false,
    "networkAccess": false,
    "webWorker": false
  },
  "discovery": {
    "priority": 178
  }
}
