{
  "schemaVersion": 1,
  "id": "hex-to-hsl",
  "version": "1.0.0",
  "type": "converter",
  "family": "color-tools",
  "variant": "hex-to-hsl",
  "slug": "hex-to-hsl",
  "icon": "color",
  "publishedAt": "2026-08-03",
  "updatedAt": "2026-08-03",
  "featured": true,
  "popularity": 84,
  "estimatedTime": "instant",
  "status": "published",
  "entry": "./index.js",
  "category": "color",
  "tags": [
    "color",
    "hex",
    "hsl"
  ],
  "aliases": [
    "hex to hsl",
    "convert hex colors to hsl values"
  ],
  "components": [
    "tool.shell",
    "field.input",
    "field.color",
    "field.select",
    "action.button"
  ],
  "capabilities": {
    "offline": true,
    "fileAccess": false,
    "networkAccess": false,
    "webWorker": false
  },
  "discovery": {
    "priority": 298
  }
}
