{
  "schemaVersion": 1,
  "id": "temperature-converter",
  "version": "1.0.0",
  "type": "converter",
  "family": "unit-converters",
  "variant": "converter",
  "slug": "temperature-converter",
  "icon": "converter",
  "publishedAt": "2026-08-03",
  "updatedAt": "2026-08-03",
  "featured": true,
  "popularity": 86,
  "estimatedTime": "instant",
  "status": "published",
  "entry": "./index.js",
  "category": "unit",
  "tags": [
    "temperature",
    "celsius",
    "fahrenheit",
    "kelvin"
  ],
  "aliases": [
    "celsius to fahrenheit",
    "temperature calculator"
  ],
  "components": [
    "tool.shell",
    "field.input",
    "field.select",
    "action.button"
  ],
  "capabilities": {
    "offline": true,
    "fileAccess": false,
    "networkAccess": false,
    "webWorker": false
  },
  "discovery": {
    "priority": 218
  }
}
