{
  "schemaVersion": 1,
  "id": "density-converter",
  "version": "1.0.0",
  "type": "converter",
  "family": "unit-converters",
  "variant": "converter",
  "slug": "density-converter",
  "icon": "converter",
  "publishedAt": "2026-08-03",
  "updatedAt": "2026-08-03",
  "featured": false,
  "popularity": 54,
  "estimatedTime": "instant",
  "status": "published",
  "entry": "./index.js",
  "category": "unit",
  "tags": [
    "density",
    "mass",
    "volume"
  ],
  "aliases": [
    "kg m3 to g cm3",
    "density calculator"
  ],
  "components": [
    "tool.shell",
    "field.input",
    "field.select",
    "action.button"
  ],
  "capabilities": {
    "offline": true,
    "fileAccess": false,
    "networkAccess": false,
    "webWorker": false
  },
  "discovery": {
    "priority": 202
  }
}
