{
  "schemaVersion": 1,
  "id": "url-parser",
  "version": "1.0.0",
  "type": "reference",
  "family": "developer-tools",
  "variant": "reference",
  "slug": "url-parser",
  "icon": "developer",
  "publishedAt": "2026-08-03",
  "updatedAt": "2026-08-03",
  "featured": false,
  "popularity": 63,
  "estimatedTime": "instant",
  "status": "published",
  "entry": "./index.js",
  "category": "developer",
  "tags": [
    "url",
    "parse",
    "components"
  ],
  "aliases": [
    "url analyzer",
    "parse url"
  ],
  "components": [
    "tool.shell",
    "field.textarea",
    "action.button"
  ],
  "capabilities": {
    "offline": true,
    "fileAccess": false,
    "networkAccess": false,
    "webWorker": false
  },
  "discovery": {
    "priority": 234
  }
}
