{
  "schemaVersion": 1,
  "id": "pressure-converter",
  "version": "1.0.0",
  "type": "converter",
  "family": "unit-converters",
  "variant": "converter",
  "slug": "pressure-converter",
  "icon": "converter",
  "publishedAt": "2026-08-03",
  "updatedAt": "2026-08-03",
  "featured": false,
  "popularity": 74,
  "estimatedTime": "instant",
  "status": "published",
  "entry": "./index.js",
  "category": "unit",
  "tags": [
    "pressure",
    "psi",
    "bar",
    "pascal"
  ],
  "aliases": [
    "psi to bar",
    "pressure calculator"
  ],
  "components": [
    "tool.shell",
    "field.input",
    "field.select",
    "action.button"
  ],
  "capabilities": {
    "offline": true,
    "fileAccess": false,
    "networkAccess": false,
    "webWorker": false
  },
  "discovery": {
    "priority": 212
  }
}
