{
  "schemaVersion": 1,
  "id": "contrast-checker",
  "version": "1.0.0",
  "type": "converter",
  "family": "color-tools",
  "variant": "contrast-checker",
  "slug": "contrast-checker",
  "icon": "color",
  "publishedAt": "2026-08-03",
  "updatedAt": "2026-08-03",
  "featured": false,
  "popularity": 67,
  "estimatedTime": "instant",
  "status": "published",
  "entry": "./index.js",
  "category": "color",
  "tags": [
    "color",
    "contrast",
    "checker"
  ],
  "aliases": [
    "contrast checker",
    "calculate wcag contrast between two colors"
  ],
  "components": [
    "tool.shell",
    "field.input",
    "field.color",
    "field.select",
    "action.button"
  ],
  "capabilities": {
    "offline": true,
    "fileAccess": false,
    "networkAccess": false,
    "webWorker": false
  },
  "discovery": {
    "priority": 281
  }
}
