{
  "schemaVersion": 1,
  "id": "voltage-converter",
  "version": "1.0.0",
  "type": "converter",
  "family": "unit-converters",
  "variant": "converter",
  "slug": "voltage-converter",
  "icon": "converter",
  "publishedAt": "2026-08-03",
  "updatedAt": "2026-08-03",
  "featured": false,
  "popularity": 46,
  "estimatedTime": "instant",
  "status": "published",
  "entry": "./index.js",
  "category": "unit",
  "tags": [
    "voltage",
    "volts",
    "electrical"
  ],
  "aliases": [
    "volts to millivolts",
    "voltage unit converter"
  ],
  "components": [
    "tool.shell",
    "field.input",
    "field.select",
    "action.button"
  ],
  "capabilities": {
    "offline": true,
    "fileAccess": false,
    "networkAccess": false,
    "webWorker": false
  },
  "discovery": {
    "priority": 198
  }
}
