{
  "schemaVersion": 1,
  "id": "css-formatter",
  "version": "1.0.0",
  "type": "formatter",
  "family": "developer-tools",
  "variant": "formatter",
  "slug": "css-formatter",
  "icon": "developer",
  "publishedAt": "2026-08-03",
  "updatedAt": "2026-08-03",
  "featured": false,
  "popularity": 77,
  "estimatedTime": "instant",
  "status": "published",
  "entry": "./index.js",
  "category": "developer",
  "tags": [
    "css",
    "format",
    "stylesheet"
  ],
  "aliases": [
    "css beautifier",
    "pretty print css"
  ],
  "components": [
    "tool.shell",
    "field.textarea",
    "action.button"
  ],
  "capabilities": {
    "offline": true,
    "fileAccess": false,
    "networkAccess": false,
    "webWorker": false
  },
  "discovery": {
    "priority": 241
  }
}
